{
  "actual_v17_artifacts_created": false,
  "bridge_protocol_version": "1.0.0",
  "complete": true,
  "control_implementation_commit": "d7af19004072a8154523e0c28f0c873865af8da2",
  "control_implementation_tree": "340e077f1ea30be134d92eb41481fc8170906321",
  "controller_conformance": {
    "cleanup_to_zero": true,
    "condition_session_count": 4,
    "first_pair_checkpoint_retained": true,
    "raw_finalizer_evaluator_chain": true,
    "receipt_semantic_sha256": "39dcb343df485c0063b94f5bb1de460292c9636b04bbe1bf4d587b57c4df3ad0",
    "shared_controller_used": true,
    "shared_production_assembly_used": true,
    "terminal_state": "category3-live-complete-clean"
  },
  "duplex_condition_sessions": {
    "all_effects_admitted_before_execution": true,
    "all_private_endpoints_removed": true,
    "all_processes_reaped": true,
    "all_remote_boundaries_nonauthoritative": true,
    "all_terminal_acknowledged": true,
    "browser_action_count": 8,
    "evidence_binding_sha256s": [
      "bee5195822c01c785386d461f56369ced7a51b50c0b63c53b26a8b8e36b7ada1",
      "3d54ef173a2b27ba91dd9419f94993a0ed110b0ee05dff00978e0153e2d2118e",
      "a7d1428555a67419d7ccaf1e161dcfb7546b3c2eb2182b70ad9026d3da47b832",
      "9285d83db0163898fa181f24cc96857d3936399772ab44179326cd00a33a5fc4"
    ],
    "local_subprocess_count": 4,
    "model_call_count": 8,
    "model_roles": [
      "actor",
      "critic",
      "default",
      "world_model"
    ],
    "private_ipc_count": 4,
    "run_ids": [
      "RUN-T09-TASK-A-REACTIVE-AUTONOMOUS-0009",
      "RUN-T09-TASK-A-SIMULATIVE-AUTONOMOUS-0009",
      "RUN-T09-TASK-B-SIMULATIVE-AUTONOMOUS-0009",
      "RUN-T09-TASK-B-REACTIVE-AUTONOMOUS-0009"
    ],
    "session_count": 4,
    "shared_transcript_sha256s": [
      "bd6ef8fcb6192f9a4bf07132b3e408605190d2809f342c1dc7e9e2558ae5c694",
      "4a188bc2bcc5a9a5171196341eb54e0380ed1615a6f4fe9ce85c71887157c500",
      "63cbb9a7fa4e66147cfd02e0d5534d89824a8bf32ba79b943c6a8eba0d32733b",
      "5309bc4473f5d149ae57923d7dd0b367cf6fbaad342f6b19e466c92983eec06f"
    ]
  },
  "effect_protocol_version": "2.0.0",
  "evidence": {
    "host_relay_transcript": true,
    "raw_and_essential_binding": true,
    "remote_mirrored_journal": true,
    "shared_authoritative_transcript": true,
    "terminal_hash_chain": true
  },
  "failure_probes": {
    "cleanup_after_bridge_failure": true,
    "disconnect_after_send": true,
    "disconnect_before_send": true,
    "replay_rejected": true,
    "response_accounting_incomplete": true,
    "transcript_mutation_rejected": true
  },
  "host_phase_entrypoints": {
    "browser_actions": 0,
    "condition_entries": 0,
    "full_manifest_validated": true,
    "model_requests": 0,
    "network_effects": 0,
    "operations": [
      "host-transfer-verify",
      "host-preflight",
      "host-qualify",
      "host-freeze",
      "host-cleanup"
    ],
    "ordered": true,
    "process_model": "forked-selected-contract-child",
    "provider_entry_precedes_transfer": true,
    "receipt_validation_projection_sha256s": [
      "757a45f2b1a0571cca77161002c47e2d62cc07c88c512987614515bbcb2ef3db",
      "110163cc340000577a131a17b3bd8d1ac49274697f0cedb4cc04c431e34e22c5",
      "6b24a1a2b2bebffa609f00e395cafc0c7aa1d300626f9a1f08b16d3ea5ce9e94",
      "6115cf48e9cc99058c0b67210afed6bb673db94fb4c9b6fe4d88b897ba3e2b5f",
      "1cff566923b479cbc6a55b781b16bf1974677f85d7a42e8967442f191c754ffe"
    ],
    "serialized_contract_override": false,
    "subprocess_count": 5,
    "tracked_runner_loaded": true,
    "transfer_rehashed": true
  },
  "live_authority_created": false,
  "production_assembly_entry_point": "giclab.control.production.build_production_adapter_assembly",
  "projected_real_cost_usd": "0.00",
  "provider_contract_version": "V16",
  "remote_runner_entry_point": "containers/sira-smoke/pragmatic/t09_remote_runner.py",
  "runtime_admission_entry_point": "giclab.harness.sira_gate_a_runtime._install_locked_llm_factory",
  "schema_version": "1.0.0",
  "scientific_interpretation_allowed": false,
  "semantic_sha256": "d81b87a29a83b77a6e8bb7fedc20ba180d957fb0ac671b83d33ca4df957035fc",
  "shared_controller_entry_point": "giclab.control.category3.execute_category3_transaction",
  "sole_accountant": {
    "coupling_probe_passed": true,
    "independent_remote_budget_boundary": false,
    "owner": "ConditionEventObserver",
    "remote_boundary_authoritative": false
  },
  "zero_real_effects": {
    "authenticated_metadata_requests": 0,
    "browser": 0,
    "cloud_mutations": 0,
    "condition_reservations": 0,
    "docker": 0,
    "live_ssh": 0,
    "new_cost_usd": "0.00",
    "provider_requests": 0,
    "scientific_actions": 0,
    "secret_reads": 0
  }
}
